{
  "$schema": "https://json-schema.org/draft/2020-12/schema",
  "$id": "https://shaneyu.dev/stationeers/ic10test.schema.json",
  "title": "IC10 Scenario Test",
  "type": "object",
  "required": ["schemaVersion", "scenario", "cases"],
  "properties": {
    "schemaVersion": {
      "const": 1,
      "description": "The test fixture schema version. See docs/scenario-testing.md before changing this value."
    },
    "scenario": {
      "type": "string",
      "minLength": 1,
      "description": "Path to a reusable .ic10sim.json file, relative to this test file."
    },
    "seed": {
      "type": "integer",
      "minimum": 0,
      "default": 0
    },
    "cases": {
      "type": "array",
      "minItems": 1,
      "items": { "$ref": "#/$defs/case" }
    }
  },
  "additionalProperties": false,
  "$defs": {
    "scalar": {
      "oneOf": [
        { "type": "number" },
        { "enum": ["NaN", "Infinity", "-Infinity", "-0"] },
        {
          "type": "string",
          "pattern": "^\\$\\{[A-Za-z_][A-Za-z0-9_]*\\}$",
          "description": "A parameter placeholder replaced before the case is validated and run."
        }
      ]
    },
    "stateMap": {
      "type": "object",
      "propertyNames": {
        "pattern": "^(?:\\$\\{[A-Za-z_][A-Za-z0-9_]*\\}|r(?:[0-9]|1[0-7])|ra|sp|stack\\[[0-9]+\\]|device\\(\"[^\"]+\"\\)\\.(?:[A-Za-z][A-Za-z0-9]*|slot\\[[0-9]+\\]\\.[A-Za-z][A-Za-z0-9]*|memory\\[[0-9]+\\])|network\\(\"[^\"]+\"\\)\\.Channel[0-7])$"
      },
      "additionalProperties": { "$ref": "#/$defs/scalar" }
    },
    "tolerance": {
      "type": "object",
      "properties": {
        "absolute": { "type": "number", "minimum": 0, "default": 0 },
        "relative": { "type": "number", "minimum": 0, "default": 0 }
      },
      "additionalProperties": false
    },
    "assertion": {
      "type": "object",
      "properties": {
        "expression": { "type": "string", "minLength": 1 },
        "eventually": { "type": "string", "minLength": 1 },
        "always": { "type": "string", "minLength": 1 },
        "atTick": { "type": "integer", "minimum": 0 },
        "withinTicks": { "type": "integer", "minimum": 0 },
        "expected": { "$ref": "#/$defs/scalar" },
        "tolerance": { "$ref": "#/$defs/tolerance" }
      },
      "oneOf": [
        { "required": ["expression"] },
        { "required": ["eventually"] },
        { "required": ["always"] }
      ],
      "additionalProperties": false
    },
    "timeline": {
      "type": "object",
      "required": ["tick"],
      "properties": {
        "tick": { "type": "integer", "minimum": 0 },
        "set": { "$ref": "#/$defs/stateMap" },
        "events": {
          "type": "array",
          "items": {
            "type": "object",
            "required": ["target", "value"],
            "properties": {
              "target": {
                "type": "string",
                "pattern": "^(?:\\$\\{[A-Za-z_][A-Za-z0-9_]*\\}|r(?:[0-9]|1[0-7])|ra|sp|stack\\[[0-9]+\\]|device\\(\"[^\"]+\"\\)\\.(?:[A-Za-z][A-Za-z0-9]*|slot\\[[0-9]+\\]\\.[A-Za-z][A-Za-z0-9]*|memory\\[[0-9]+\\])|network\\(\"[^\"]+\"\\)\\.Channel[0-7])$"
              },
              "value": { "$ref": "#/$defs/scalar" }
            },
            "additionalProperties": false
          }
        }
      },
      "additionalProperties": false
    },
    "scriptAction": {
      "oneOf": [
        {
          "type": "object",
          "required": ["action", "target", "value"],
          "properties": {
            "action": { "const": "set" },
            "target": { "type": "string", "minLength": 1 },
            "value": { "$ref": "#/$defs/scalar" }
          },
          "additionalProperties": false
        },
        {
          "type": "object",
          "required": ["action", "from", "to"],
          "properties": {
            "action": { "const": "moveSlot" },
            "from": { "type": "string", "pattern": "^device\\(\"[^\"]+\"\\)\\.slot\\[[0-9]+\\]$" },
            "to": { "type": "string", "pattern": "^device\\(\"[^\"]+\"\\)\\.slot\\[[0-9]+\\]$" }
          },
          "additionalProperties": false
        },
        {
          "type": "object",
          "required": ["action", "network", "channel", "value"],
          "properties": {
            "action": { "const": "publish" },
            "network": { "type": "string", "minLength": 1 },
            "channel": { "type": "integer", "minimum": 0, "maximum": 7 },
            "value": { "$ref": "#/$defs/scalar" }
          },
          "additionalProperties": false
        },
        {
          "type": "object",
          "required": ["action", "afterTicks", "actions"],
          "properties": {
            "action": { "const": "schedule" },
            "afterTicks": { "type": "integer", "minimum": 0 },
            "actions": {
              "type": "array",
              "minItems": 1,
              "maxItems": 1024,
              "items": { "$ref": "#/$defs/scriptAction" }
            }
          },
          "additionalProperties": false
        }
      ]
    },
    "scriptedDriver": {
      "type": "object",
      "required": ["id", "rules"],
      "properties": {
        "id": { "type": "string", "minLength": 1 },
        "model": { "type": "string", "minLength": 1, "default": "scenario.scripted" },
        "version": { "type": "integer", "minimum": 1, "default": 1 },
        "rules": {
          "type": "array",
          "minItems": 1,
          "maxItems": 256,
          "items": {
            "type": "object",
            "required": ["when", "actions"],
            "properties": {
              "name": { "type": "string" },
              "when": {
                "type": "object",
                "required": ["target"],
                "properties": {
                  "target": { "type": "string", "minLength": 1 },
                  "equals": { "$ref": "#/$defs/scalar" }
                },
                "additionalProperties": false
              },
              "actions": {
                "type": "array",
                "minItems": 1,
                "maxItems": 1024,
                "items": { "$ref": "#/$defs/scriptAction" }
              }
            },
            "additionalProperties": false
          }
        }
      },
      "additionalProperties": false
    },
    "error": {
      "type": "object",
      "required": ["kind"],
      "properties": {
        "kind": { "enum": ["compile", "runtime"] },
        "messageContains": { "type": "string" }
      },
      "additionalProperties": false
    },
    "snapshot": {
      "type": "object",
      "required": ["values"],
      "properties": {
        "values": {
          "type": "object",
          "additionalProperties": { "$ref": "#/$defs/scalar" }
        }
      },
      "additionalProperties": false
    },
    "case": {
      "type": "object",
      "required": ["name"],
      "properties": {
        "name": { "type": "string", "minLength": 1 },
        "maxTicks": { "type": "integer", "minimum": 1, "default": 100 },
        "maxOperations": { "type": "integer", "minimum": 1, "default": 100000 },
        "focusIc": { "type": "string", "minLength": 1 },
        "initial": { "$ref": "#/$defs/stateMap" },
        "timeline": {
          "type": "array",
          "items": { "$ref": "#/$defs/timeline" }
        },
        "drivers": {
          "type": "array",
          "maxItems": 32,
          "description": "Deterministic declarative drivers for unsupported active devices.",
          "items": { "$ref": "#/$defs/scriptedDriver" }
        },
        "expect": {
          "type": "array",
          "items": { "$ref": "#/$defs/assertion" }
        },
        "expectError": { "$ref": "#/$defs/error" },
        "parameters": {
          "type": "array",
          "items": {
            "type": "object",
            "minProperties": 1,
            "properties": { "name": { "type": "string" } },
            "additionalProperties": {
              "type": ["string", "number", "boolean"]
            }
          }
        },
        "snapshot": { "$ref": "#/$defs/snapshot" }
      },
      "additionalProperties": false
    }
  }
}
